{
  "schema_version": "1.0",
  "protocol_version": "1.0",
  "theory_file": {
    "path": "../third-place-content.md",
    "sha256": "91fd689b30e0ccb4aae1a9ff092391b6d3993ffe1266a45e0f4f1e4e33b974ab"
  },
  "snapshot": {
    "snapshot_id": "S1",
    "snapshot_date": null,
    "source_workbook": "claim_wall_S1.xlsx",
    "entry_count": 39,
    "uncertain_count": 7,
    "analyst": "Claude Code, following ANALYSIS_PROTOCOL.md v1.0",
    "generated_at": "2026-10-01T11:15:11Z",
    "notes": [
      "Snapshot_Date is blank for all S1 rows in the workbook, so snapshot_date is null.",
      "Not captured: a pink card at the top-left corner of the board, outside the grid, was cut off in all photographs (workbook Notes sheet). It is not in Entries and is not coded."
    ]
  },
  "entries": [
    {
      "entry_id": "S1-001",
      "claim_no": 1,
      "discipline": "Psychology",
      "card_text": "People don't want to be in crowded spaces.",
      "transcription_confidence": "High",
      "transcription_caveat": null,
      "caveat_affects": [],
      "oldenburg": {
        "engagement": "none",
        "characteristics": [],
        "none_rationale": {
          "quotes": [
            "crowded spaces"
          ],
          "text": "\"crowded spaces\" concerns how full a place is; it matches no definitional element of the eight characteristics."
        },
        "vocabulary_flags": []
      },
      "strength": {
        "claim_fit": {
          "score": 1,
          "rationale": {
            "quotes": [
              "don't want to be in crowded spaces"
            ],
            "text": "States a preference about being in spaces but no effect on how many places exist; reaching Quantity needs unstated steps (avoidance, then less use, then closure). Being in a space is most directly a matter of use."
          },
          "misfiled_to": 2,
          "not_an_explanation": null
        },
        "mechanism": {
          "score": 0,
          "rationale": {
            "quotes": [
              "People don't want to be in crowded spaces"
            ],
            "text": "A condition (a preference) with no stated effect on anything; no causal relation."
          }
        },
        "explains_change": {
          "score": 0,
          "rationale": {
            "quotes": [
              "don't want"
            ],
            "text": "Presented as a standing preference; no change language and nothing implying the preference shifted."
          }
        },
        "lens_fit": {
          "score": 1,
          "rationale": {
            "quotes": [
              "don't want"
            ],
            "text": "A preference is a Psychology variable, but no causal relation is stated (mechanism 0), so, as with a bare label, the lens is indicated by vocabulary but no causal work can be assessed."
          },
          "actual_lens": {
            "primary": "Psychology",
            "secondary": []
          }
        },
        "testability": {
          "score": 1,
          "rationale": {
            "quotes": [
              "don't want to be in crowded spaces"
            ],
            "text": "The effect is not stated; one element (avoidance of crowded places) must be supplied before an implication follows."
          },
          "testable_implication": "If people do not want to be in crowded spaces, one would expect crowded third places to lose more visitors than uncrowded ones, compared with no difference by crowding.",
          "implication_note": "Supplied element: the effect, read as avoidance of crowded places."
        },
        "scope": {
          "score": 2,
          "rationale": {
            "quotes": [
              "crowded spaces"
            ],
            "text": "Names a subset of places (crowded ones); the card would not apply to places that are not crowded."
          },
          "stated_scope": "crowded spaces",
          "bodo_question": "Do third places in a small city reach the levels of crowding the card has in mind, and would gatherings organised through clubs be affected in the same way?"
        }
      }
    },
    {
      "entry_id": "S1-002",
      "claim_no": 1,
      "discipline": "Psychology",
      "card_text": "Social media isolation (bad reputation given by influencers)",
      "transcription_confidence": "High",
      "transcription_caveat": null,
      "caveat_affects": [],
      "oldenburg": {
        "engagement": "none",
        "characteristics": [],
        "none_rationale": {
          "quotes": [
            "Social media isolation",
            "bad reputation given by influencers"
          ],
          "text": "Neither \"isolation\" nor a \"bad reputation\" matches a definitional element of any characteristic; the card does not say what has the bad reputation."
        },
        "vocabulary_flags": []
      },
      "strength": {
        "claim_fit": {
          "score": 1,
          "rationale": {
            "quotes": [
              "Social media isolation",
              "bad reputation given by influencers"
            ],
            "text": "Two noun phrases with no stated effect; the filing position is the only link to the number of places. No other claim is a more direct fit, because no effect is stated."
          },
          "misfiled_to": null,
          "not_an_explanation": null
        },
        "mechanism": {
          "score": 0,
          "rationale": {
            "quotes": [
              "Social media isolation",
              "bad reputation given by influencers"
            ],
            "text": "Bare noun phrases; no effect on third places and no pathway is stated."
          }
        },
        "explains_change": {
          "score": 1,
          "rationale": {
            "quotes": [
              "isolation"
            ],
            "text": "\"isolation\" can denote a state or a process; the card does not state that social media use or influencer reputation changed."
          }
        },
        "lens_fit": {
          "score": 1,
          "rationale": {
            "quotes": [
              "isolation",
              "bad reputation"
            ],
            "text": "Isolation and reputation (perception) are Psychology variables, but no causal relation is stated (mechanism 0), so, as with a bare label, the lens is indicated by vocabulary but no causal work can be assessed."
          },
          "actual_lens": {
            "primary": "Psychology",
            "secondary": []
          }
        },
        "testability": {
          "score": 0,
          "rationale": {
            "quotes": [
              "bad reputation given by influencers"
            ],
            "text": "The card does not say what has the bad reputation or what follows from it; the analyst would have to supply both effect and pathway."
          },
          "testable_implication": null,
          "implication_note": "No effect or pathway is stated; deriving an implication would mean writing the explanation for the student."
        },
        "scope": {
          "score": 1,
          "rationale": {
            "quotes": [
              "influencers"
            ],
            "text": "Influencers and social media are actors whose presence varies, which implies but does not state a scope."
          },
          "stated_scope": "Implied: settings where social media and influencers shape reputations.",
          "bodo_question": "Would reputations formed by influencers bear on third places in a small city, where people may know the places directly, and would club-based places be affected in the same way?"
        }
      },
      "analyst_note": "Workbook note: first letter of 'media' obscured by pin; reading not in doubt, so no caveat."
    },
    {
      "entry_id": "S1-003",
      "claim_no": 1,
      "discipline": "Economics",
      "card_text": "They aren't economically viable. The don't make enough revenue. They don't break even, harder to stay in business.",
      "transcription_confidence": "High",
      "transcription_caveat": null,
      "caveat_affects": [],
      "oldenburg": {
        "engagement": "none",
        "characteristics": [],
        "none_rationale": {
          "quotes": [
            "economically viable"
          ],
          "text": "The card concerns revenue and viability; it describes no definitional element of any characteristic."
        },
        "vocabulary_flags": []
      },
      "strength": {
        "claim_fit": {
          "score": 2,
          "rationale": {
            "quotes": [
              "harder to stay in business"
            ],
            "text": "Staying in business is the Quantity variable directly: places that cannot stay in business close."
          },
          "misfiled_to": null,
          "not_an_explanation": null
        },
        "mechanism": {
          "score": 2,
          "rationale": {
            "quotes": [
              "The don't make enough revenue",
              "They don't break even",
              "harder to stay in business"
            ],
            "text": "Cause (insufficient revenue) leads to a stated intermediate (not breaking even) and then to the effect (harder to stay in business)."
          }
        },
        "explains_change": {
          "score": 1,
          "rationale": {
            "quotes": [
              "harder to stay in business"
            ],
            "text": "\"harder\" implies a shift, but the card does not state that revenue or costs changed."
          }
        },
        "lens_fit": {
          "score": 2,
          "rationale": {
            "quotes": [
              "revenue",
              "break even"
            ],
            "text": "Revenue and break-even are Economics variables and do all the causal work."
          },
          "actual_lens": {
            "primary": "Economics",
            "secondary": []
          }
        },
        "testability": {
          "score": 2,
          "rationale": {